_id,title,brief,content,createTime,url,imageUrl,isRecommend,hasImage
520decf08bcaeda26255db412c2750ba,李开复、刘知远、知乎直答……一群对AI上头的人做了场学术酒吧活动,对ＡＩ上头，用知识下酒。１１月１５日，知乎于北京举办了一场别开生面的学术酒吧活动—ＡＩ上头俱乐部。零一万物ＣＥＯ、创新工场董事长李开复，清华大学副教授刘知远，上海交通大学副教授、无问芯穹联合创始人兼首...,<p>对ＡＩ上头，用知识下酒。１１月１５日，知乎于北京举办了一场别开生面的学术酒吧活动—ＡＩ上头俱乐部。零一万物ＣＥＯ、创新工场董事长李开复，清华大学副教授刘知远，上海交通大学副教授、无问芯穹联合创始人兼首席科学家戴国浩等数十位ＡＩ领域领军人物，共同探讨了人工智能的最新发展和未来趋势。此外，知乎直答产品负责人马奎及多位知乎答主登上现场开放麦，在轻松的氛围中交流ＡＩ行业背后的故事。</p><p>知乎首场学术酒吧的学术氛围如同专题论坛。零一万物ＣＥＯ、创新工场董事长李开复率先与北京智星青年人才科技创新研究院技术副院长苏洋，进行了一场题为《中美人工智能竞争视角下中国企业的第二条路》的对谈。李开复表示，作为大模型独角兽零一万物的一个策略是，用“模型➕ＡＩ　ｉｎｆｒａ➕应用”共创的三位一体布局，以最少的训推成本训练出世界第一梯队的模型，而且更快更好更便宜，“我们的目标与世界顶级的差距始终保持在六个月之内。我们的新旗舰模型Ｙｉ－Ｌｉｇｈｔｎｉｎｇ近期在世界权威盲测ＬＭＳＹＳ中排名世界第六，超过了ＧＰＴ－４ｏ（５月版本），这也是中国大模型此榜单历史最佳成绩，而且我们的推理成本仅是ＧＰＴ４的３％。”</p><p>李开复表示：“以Ｏｐｅｎ　ＡＩ为代表的美国公司创新能力引领全球，中国大模型创业者勤奋努力，有世界顶尖的工程能力和强大的执行力，这些要素不仅让我们能‘多快好省’训出顶尖模型，加速大模型价格普惠点到来，还能迎合中国巨大的市场，丰富的落地场景引爆ＡＩ应用时代的到来。这为我们提供了一个独特机遇，在ＡＩ－ｆｉｒｓｔ新时代占据领先地位。”</p><p>清华大学副教授刘知远，在自然语言处理、深度学习、机器学习等领域有着深厚的学术造诣和丰富的研究成果，２０２２年参与创建了面壁智能并担任首席科学家。他带来了题为《大模型知识密度定律》的议题分享，对大模型之于人类社会的未来做出了多项判断。刘知远认为，大模型技术目前只是打开了一个门缝，未来“全球智能体将互相形成智能体网络，迎来人工智能第二次涌现”。</p><p>除了专业、深度的主题分享，知乎学术酒吧别出心裁设置了开放麦环节，带来一场ＡＩ行业的线下脱口秀。知乎直答负责人马奎以《当一款ＡＩ产品上线新功能之后》为题，讲述了产品上线前后的历程。马奎透露知乎直答的专业搜索功能被要求“尽量１０月底”上线，“你们懂的，翻译翻译，就是必须完成”。也正因为如此，知乎直答相比国外大厂发布同类功能提早了一天，创造了一个“第一”。现场，知乎直答专业搜索功能受到了李开复、刘知远等一众ＡＩ领军人物的夸赞，马奎表示“这让人很上头”也坚定了产品的发展信心。</p><p>“凡事可以问ＡＩ的时代，人们还需要什么样的科普内容创作”，年度新知答主、高能物理学博士子乾以此为题进行了分享，其表示“越是在ＡＩ时代，人们越是需要有人情味的内容，科普创作者更要热爱生活”。ＡＩ创业者李博杰带来了题为《漏洞＆Ｂｕｇ——有哪个瞬间让你觉得这个世界出ｂｕｇ了？》的开放麦表演，其围绕自己过往经历调侃了现实世界中的种种漏洞。</p><p>作为学术酒吧的主办方，知乎也展示了最新的ＡＩ“学术”进展：于１０月底知乎直答正式上线的“专业搜索”功能。为了检验这项产品能力，清华大学副教授刘知远，上海交通大学副教授、无问芯穹联合创始人兼首席科学家戴国浩在演讲之后，向其“投喂”了两篇学术论文，知乎直答均给予了准确、翔实的解析，赢得了在场专业人士的喝彩与认可。</p><p>知乎直答自今年６月上线以来，凭借优质内容语料优势和搜索结果的超强溯源能力，被视为“中文版Ｐｅｒｐｌｅｘｉｔｙ”。此番专业搜索的推出，标志着知乎直答成为国内首家提供ＡＩ搜索与正版论文库一站式解决方案的产品，其引入维普、知乎精选等专业内容源，涵盖超过５０００万篇中英文文献数据，极大满足广大用户对于高质量信息的需求。</p><p>近２００位ＡＩ领域从业者参与了这场知乎学术酒吧“ＡＩ上头俱乐部”交流，分享者以轻松自在的形式分享思考与见解，参与者遇见志同道合的朋友，收获思想碰撞的奇妙火花。从线上专业讨论到线下学术酒吧，知乎作为ＡＩ行业的第一讨论场，正吸引越来越多从业者的关注，共同思考和探索人工智能的未来。</p>,2024年11月18日 11:28,https://finance.sina.com.cn/tech/roll/2024-11-18/doc-incwmzsr3733885.shtml,https://n.sinaimg.cn/spider20241118/200/w600h400/20241118/7d40-b56a9b6d2404277bb4449c02bfd196dd.jpg,False,True
f7cb264df7084a922ae52005ad1ea736,防丢钥匙扣 曝苹果AirTag2将在明年发布,据外媒爆料，苹果将会在明年发布AirTag2，这款产品将会升级芯片，并改进位置跟踪功能，可以在更远的距离内起作用。AirTag是在2021年4月发布的国内价格229元，用途是帮助你追踪物品。所以很多购...,<p>据外媒爆料，苹果将会在明年发布AirTag2，这款产品将会升级芯片，并改进位置跟踪功能，可以在更远的距离内起作用。AirTag是在2021年4月发布的国内价格229元，用途是帮助你追踪物品。所以很多购买者也戏称，这是自己购买过最贵的钥匙链。</p><p>在AirTag与iPhone配对后，在界面中会显示定位和方向，用户在手机上按下“播放声音”按钮，AirTag就会发出提示音，如果距离不远用户循着声音就可以找到想要的物品。虽然是防丢神器，但是在国外AirTag也因为协助不法分子跟踪受害者而被提起诉讼。</p>,2024年11月18日 11:27,https://finance.sina.com.cn/tech/roll/2024-11-18/doc-incwnfyp3620597.shtml,https://n.sinaimg.cn/spider20241118/203/w2000h1403/20241118/b699-86631f836395ba8b92a0a3138b383c8f.jpg,False,True
576aea19589d0c102837ff76b45c82a2,中能拾贝携AI产品方案亮相2024广州市人工智能产业链供需对接活动,近日，广州市工业和信息化局主办、广州市人工智能产业发展促进会承办的2024广州市人工智能产业链供需对接活动圆满举行。作为一家专注于服务资产密集型企业的工业智能产品与服务提供商，中能拾贝受邀与相关政府部...,<p>近日，广州市工业和信息化局主办、广州市人工智能产业发展促进会承办的2024广州市人工智能产业链供需对接活动圆满举行。</p><p>作为一家专注于服务资产密集型企业的工业智能产品与服务提供商，中能拾贝受邀与相关政府部门、科研机构、金融机构、行业协会、人工智能企业等代表超过150人出席活动，并做《基于多模态大模型实时视觉智能分析识别》的专题报告。</p><p>为加快发展新一代人工智能产业，2024年，广州市工业和信息化局发布了《2024年广州市数字经济工作要点》《广州市人工智能典型案例册》《广州市“人工智能+”优秀解决方案册》等系列政策，从算力资源布局，数据要素生态建设，传统企业“上云上链”，产业需求“揭榜挂帅”体系等方面，进一步鼓励企业增强自主创新能力，加快提升人工智能方面的核心竞争力，解决人工智能重大应用和产业化问题，推动广州市人工智能赋能新质生产力发展。</p><p>乘着人工智能系列政策的“东风”，中能拾贝率先加速布局AI产品及技术，推出以多模态大模型为核心的拾贝云CyberwLLM及解决方案，赋能资产密集型工业企业的智慧运营，以AI创新应用助力企业跑出高质量发展“加速度”。</p><p>值得关注的是，拾贝云CyberwLLM作为国内工业AI大模型代表，凭借创新多场景应用获得IDC《工业大模型应用进展及展望，2024》报告推荐。</p><p>在与会领导和嘉宾的共同见证下，中能拾贝产品总监尚洪阳带来《基于多模态大模型实时视觉智能分析识别》的AI大模型及应用分享，以丰富的行业实践与社会各界共促人工智能产业发展。</p><p>尚洪阳介绍，中能拾贝的拾贝云大模型CyberwLLM可提供企业级的机器视觉推理应用，通过预置模型服务，满足企业一站式AI应用服务，适用于巡检和安防业务的各类落地场景，赋能工业互联智慧应用。</p><p>基于拾贝云CyberwLLM，他为与会嘉宾介绍了丰富的多模态大模型产品应用场景，展示了包括工作服/安全带识别、冒烟/烟火识别、安全帽/违章作业识别、闯入禁区/动物入侵识别、摔倒/长时间固定作业识别、人员聚集/玩手机识别、高空抛物识别等作业风险场景，表计/开关/刀闸/指压板识别、设备/铭牌识别等巡检场景的多模态大模型应用。</p><p>中能拾贝的AI大模型产品已成功应用于国内外多家大型企业及发电集团。在广西装机规模最大的某发电企业，中能拾贝为其提供工业电视视觉识别系统建设，透过视频AI算法训练，建立AI算法库，实现视频智能视觉管理系统。该系统可与生产管控、智慧安防、智慧设备、智慧运行联动，对人员典型违章、设备渗漏、火灾等状态异常进行自动识别、告警，有效提升生产管控的智能化程度。</p><p>在我国乌江干流上第一座大型水电站的智能安全管控平台建设项目中，中能拾贝为其提供视频智能分析及联动，透过AI产品及服务实现包括安全帽佩戴检测、安全带佩戴检测、盖板开启检测等，为水电站的安全运行“保驾护航”。</p><p>此次对接会为人工智能产业链供需双方搭建了高效的交流平台，有效推动人工智能产业链上下游精准对接，加速技术成果转化，提高产业整体效益。未来，中能拾贝将深耕技术，持续完善矩阵式产品体系，以数智化服务助力资产密集型企业提质增效，迈向高质量发展。</p>,2024年11月18日 11:25,https://finance.sina.com.cn/tech/roll/2024-11-18/doc-incwmzsw3944188.shtml,https://n.sinaimg.cn/spider20241118/200/w1080h720/20241118/0b00-bd819b71415ea673cf544810da930e5c.webp,False,True
dbd3798b37c44afcef844c5e2fc7731e,弱势行情做妖股！低位的AI应用具备走出大牛的机会！,2024年11月18日 11:19:06弱势行情做妖股！低位的AI应用具备走出大牛的机会！弱势行情做妖股！市值管理操作难度太大！1：周末最大的利好就是市值管理，但我个人认为这个市值管理对市场的影响有限...,"<p>2024年11月18日 11:19:06</p><p>弱势行情做妖股！低位的AI应用具备走出大牛的机会！</p><p>弱势行情做妖股！市值管理操作难度太大！</p><p>1：周末最大的利好就是市值管理，但我个人认为这个市值管理对市场的影响有限，这个Z策，背后的目的可能是让行情高低切换，但破净资产的公司为什么会破净资产，能长期低位运行的股票，都是有他的原因的，能因为这样一个政策他就涨上天了吗，显然不能，股票上涨的核心是有资金往上买，大家都看好他的前景，但这个破净资产，会不会有资金持续性的往上买？显然不可能吗,除非GJD往上买，GJD会买吗？显然不会，除非平准基金进场来了，其实这些破净股大多没什么成长性，上涨大概率都是一次性的，有利好来一把，至于说让公司自己搞市值管理，上市公司会买自己家的股票吗？这种概率也比较低啊，套现才是他们的核心目标。至于说规范的，让公司出各种策略性的东西，但这都不是实质性利好，嘴炮能让股票涨一时，不具备持续性，让市场看到实质性的利好，才能涨。</p><p>市值管理也不是今天才出来的政策，2005年就提出了市值管理，2014年牛市发扬光大，但到今天破净股还是一堆一堆的，效果肯定是不及预期的，毕竟这是一个套现卖方市场，市值管理可能是个伪命题，有可能被理解为包装华丽的外衣。</p><p>股市照进现实，其实都一样，一分钱一分货！不过，破净股倒是可以变成个股的加分项，本身个股就有上涨预期，叠加破净属性，可能会有超额预期，比如上汽集团这种。</p><p>2：股市进入下行周期，就是一个挤泡沫的过程，前面经过暴力拉升的，三四倍涨幅的票，就有很强的向下引力，但也不要指望底部没涨的能够持续性补涨。我现在的目标，主要集中在前面涨幅1倍左右的票，进可攻，退可守。尽量远离低空经济，以及经历暴涨的股权转让类的重组票，目前比较适合打埋伏。</p><p>3：目前打埋伏比较合理的是前面长期趴在底部的人工智能，上周经历一轮大涨，但总体涨幅依然在1倍左右，和前面的新知生产力的三四倍涨幅，还是很有吸引力的，毕竟人工智能现在已经进入应用爆发期，大模型已经进入瓶颈，说明大模型已经开始进入了工具类划分，相当于当年的科技硬件电脑和操作系统，最后都变成了工具，而后面持续性爆发的走出历史大牛的是应用，比如微信，抖音，淘宝等等，现在微信，淘宝，抖音等都变成平台应用，是一个道理，现在的大模型就是一个工具，使用大模型这个工具，创造价值的时代开启了.这个方向上涨大涨，但今天开始又大跌了，如果连跌几天回归原点了，低吸的机会不就来了吗</p><p>具体的：</p><p>AI智能体</p><p>AI助手</p><p>AI多模态</p><p>AI+营销</p><p>AI+传媒</p><p>AI+机器人</p><p>等等：注意，AI应用未来大概率会走出超级大**，重演前端时间低空经济，商业航天等行情，上周的放量大涨，但股价多在1倍左右涨幅，首次放量可以理解为主力拿筹码的过程，本周大跌可以看作洗盘的过程，真正的行情，大概率会在下周。本周耐心低吸。</p><p>我从题材，主线的把握，还是比较有自信的，本周受正策消息面的影响，资金在拉升低位权重，但我认为这都是虚晃一招，真正的目的是洗AI。</p>",2024年11月18日 11:19,https://finance.sina.com.cn/tech/roll/2024-11-18/doc-incwmzsr3719779.shtml,https://n.sinaimg.cn/tech/zcapp2018/doc_qrcode1.png,False,True
a530f86e94ec8599a93ad737ab939e46,小鹏AI机器人Iron惊艳亮相，微美全息（WIMI.US）稳步推进布局加速商业化进程,近日，人形机器人行业好消息不断。获悉，11月13日，小鹏汽车（XPEV.US）推出了全新的AI机器人Iron。Iron采用仿人结构设计，身高178cm，体重70kg，拥有62个主动自由度；”大脑“采用...,<p>近日，人形机器人行业好消息不断。获悉，11月13日，小鹏汽车（XPEV.US）推出了全新的AI机器人Iron。</p><p>Iron采用仿人结构设计，身高178cm，体重70kg，拥有62个主动自由度；”大脑“采用图灵AI芯片，能够像人一样思考记忆，同时也让手脚自主活动，双手也采用1：1人类双手尺寸，有15个双手自由度。</p><p>小鹏汽车称，该机器人与智驾体系同源，采用了AI汽车上的鹰眼视觉系统，可以无死角看世界，还运用了端到端大模型和强化学习算法，让机器人的行走拥有驾驶般的能力。</p><p>人形机器人加速面世</p><p>上周，11月5日至10日，第七届中国国际进口博览会在上海国家会展中心举办。今年进博会，各种“高精尖”的前沿技术和产品云集，人形机器人再次成为众人目光的焦点。</p><p>机器人们早已“跳脱”出与技术相关的展区和展台，落地应用遍地生花，各种形态的机器人们广泛应用于导览、配送、物流、教育、娱乐、医疗、工业等复杂场景，为普通消费者和企业用户们提供服务。</p><p>前不久，马斯克在沙特投资倡议论坛（FII）再次预测，2040年前，机器人数量将超过人类，至少有100亿个机器人投入使用，每个价格在2万美元至2.5万美元之间，美好蓝图有效拉高了市场对于人形机器人的期待。</p><p>就实际产业情况而言，2024年以来，多家上市公司通过开设人形机器人业务、投资入股人形机器人产业链公司，或者与人形企业开展合作研发等方式，直接和间接进入人形机器人板块，且这些企业普遍业绩表现优越。</p><p>人形机器人产业趋势明确，目前产业进入“从0到1”的重要突破阶段。值得一提的是，今年以来，许多人形机器人整机企业也融资火热。据不完全统计，今年上半年，全球人形机器人领域融资金额已突破70亿元人民币，超过2023年全年的融资额。</p><p>微美全息AI机器人打造强大动力</p><p>当下，人形机器人产业正迎来前所未有的发展机遇，作为推动制造业高质量发展的重要支撑，智能机器人技术已成为引领产业数字化转型的关键力量。资料显示，微美全息（WIMI.US）作为全球领先的AI机器人公司，通过技术创新和紧密合作，为市场用户提供量身定制的机器人解决方案，以满足客户的多元需求。</p><p>机器人是未来重要增长赛道之一，微美全息精准把握时代潮流，加速AI机器人真正进入人类生活。考虑到抢占人形机器人新赛道，必须打通全链条，建立生态，微美全息以AI机器人整机产品为突破口，支持建立创新研发中心，融入AI机器人整机制造产业链，加快机器人整机面世，进一步走向商业化应用。</p><p>结尾</p><p>人形机器人不是一个新的话题，当前属于人形机器人进入量产前夕，不过，这不代表人形机器人可以迅速走进千家万户。就全行业来说，人形机器人完全进入家庭化场景，可能还需要5到10年，就像当年的智能手机，还需要不断迭代。因此，未来相关企业仍需要持续科技创新，用科技给更多人带来美好出行生活。</p>,2024年11月18日 11:18,https://finance.sina.com.cn/tech/roll/2024-11-18/doc-incwmzsu7161401.shtml,https://n.sinaimg.cn/spider20241118/184/w715h269/20241118/034a-0ba64a48ec3fb4898b23e7da418250d3.jpg,False,True
0feb732701601335c23c6afcfbde7a7c,马斯克将直接受益吗 特朗普政府据称拟放宽自动驾驶汽车规定,据媒体援引知情人士的话报道，美国总统唐纳德·特朗普过渡团队的成员告诉顾问，他们计划将完全自动驾驶汽车的联邦法律框架作为交通部的优先事项之一。这表明，特朗普政府拟放宽自动驾驶汽车规定。在现行的联邦法规下...,<p>据媒体援引知情人士的话报道，美国总统唐纳德·特朗普过渡团队的成员告诉顾问，他们计划将完全自动驾驶汽车的联邦法律框架作为交通部的优先事项之一。这表明，特朗普政府拟放宽自动驾驶汽车规定。</p><p>在现行的联邦法规下，那些希望大规模部署无方向盘或刹车汽车的公司——特斯拉是其中之一——面临重大阻碍。</p><p>虽然美国交通部可以通过国家公路交通安全管理局（NHTSA）颁布规则，以促进自动驾驶汽车的运行，但国会法案将为自动驾驶汽车的大规模采用铺平道路。知情人士表示，一项正在讨论的两党立法措施将制定有关自动驾驶汽车的联邦法规。</p><p>知情人士还透露，特朗普团队正在寻找合适的人选来领导美国交通部，以制定监管自动驾驶汽车的政策框架。</p><p>知情人士表示，特朗普正在考虑的交通部长人选之一是前优步高管埃米尔·迈克尔（Emil Michael），他已经与特朗普的团队和潜在工作人员交谈过。</p><p>此外，密苏里州共和党众议员萨姆·格雷夫斯（Sam Graves）和路易斯安那州共和党众议员加勒特·格雷夫斯（Garrett Graves）也是潜在的人选。</p><p>过去几年，制定联邦立法来监管自动驾驶汽车的努力一直遇阻。</p><p>目前，NHTSA允许制造商在获得豁免的情况下，每年部署2500辆自动驾驶汽车。此前，希望将这一数字增加到10万辆的立法努力一再失败。</p><p>几年前，在特朗普第一任期内，一项旨在实现这一目标的法案在众议院获得通过，但却在参议院陷入僵局。拜登政府执政第一年曾试图将该法案与其他立法合并，但因一些制造商试图在法案中加入阻止消费者起诉或发起集体诉讼案件的措辞而失败。</p><p>马斯克将直接受益</p><p>特朗普政府放宽自动驾驶规则将令特斯拉首席执行官、特朗普大金主埃隆·马斯克直接受益。马斯克已经成为特朗普核心圈子里的重要人物。他把特斯拉的未来押在了自动驾驶技术和人工智能上。</p><p>马斯克今年10月宣布，计划从2026年开始大规模生产无需驾驶员操控的特斯拉无人驾驶机器人出租车。但美国现行法规对马斯克所谓的Cybercab计划构成了重大障碍，包括限制其部署的上限。</p><p>马斯克上个月在特斯拉第三季度财报电话会上呼吁制定国家法规，允许自动驾驶汽车在没有传统驾驶员控制的情况下在美国道路上行驶。马斯克还表示，他将利用在美国政府的潜在职位，推动一种更精简的监管方式，以批准在全美范围内使用全自动驾驶汽车</p><p>上周，特朗普任命马斯克和企业家维韦克·拉马斯瓦米领导拟成立的“政府效率部”。特朗普在一份声明中称，“政府效率部”将“为拆解政府官僚机构铺平道路，削减多余的监管法规和浪费的开支，并重组联邦机构”。</p>,2024年11月18日 11:12,https://finance.sina.com.cn/tech/roll/2024-11-18/doc-incwmzst0494353.shtml,https://n.sinaimg.cn/spider20241118/175/w600h375/20241118/33e5-5baf8e128ff037c57327538165c01757.jpg,False,True
010ce7006efde5811ac77644f34ca908,苹果AirTag 2或明年亮相，万能防丢神器大升级,据爆料，苹果将在明年推出AirTag 2，爆料称代号是B589，将升级芯片，并改进了位置跟踪功能，能在更远的距离内响应，它内置的扬声器不容易拆卸，整体设计跟上代没有太大变化。苹果在2021年4月发布了...,<p>据爆料，苹果将在明年推出AirTag 2，爆料称代号是B589，将升级芯片，并改进了位置跟踪功能，能在更远的距离内响应，它内置的扬声器不容易拆卸，整体设计跟上代没有太大变化。</p><p>苹果在2021年4月发布了AirTag，国行首发价是229元，它最大的用途就是帮你追踪各种物品。跟其它追踪器有一点不一样，AirTag并没有GPS模块，也不能单独联网，但它不仅能实现近距离的精确查找，也能实现远距离的定位。</p><p>AirTag跟iPhone配对成功之后，用户只需在手机上按下“播放声音”按钮，AirTag就会发出提示音，用户循着声音就可以找到想要的物品，整个查找过程非常顺利。</p>,2024年11月18日 11:10,https://finance.sina.com.cn/tech/roll/2024-11-18/doc-incwnfyp3620845.shtml,https://n.sinaimg.cn/tech/zcapp2018/doc_qrcode1.png,False,True
